<?xml version="1.0" encoding="UTF-8"?>
<!DOCTYPE famille SYSTEM "../dtd/famille.dtd">
<!--  famille-7.xml -->
<famille id="fm" responsable="Resp" nom="mammifères-marins" >
	<famille responsable="resp1" nom="cétacés" id="fc">
		<animal id="a1" nom="Flipper" date-naissance="2003-10-23" espece="dauphin" />
		<animal id="b1" nom="Ecco"  date-naissance="1996-12-25" espece="dauphin"/>
		<animal id="c1" nom="Oum" taille="295" poids="190" sexe="M" espece="dauphin"/>
	</famille>
	<famille id="fp" responsable="M.Chef" nom="pinnipèdes" >
		<animal id="a4" nom="Ben" espece="phoque" />
		<animal id="b4" nom="Kim" espece="otarie" />
		<animal id="a2" taille="155" poids="80" sexe="M" espece="otarie" nom="Ben" />
	</famille>
</famille>